ID,DAY,RACE,ACTOR,TEXT,TYPE,TONE,MOOD,CLIENT,GIFT,SUSPECT1,SUSPECT2,SUSPECT3,CORRECTANSWER
#DD06010000--,DD,Desconocida,Minijefe,"¡Hola simio sin pelo!, aún no me conoces, pero a partir de ahora seré tu superior! (como si no lo fuera de por sí ya)",init,exclamative,saluting,clientZERO,,,,,
#DD06010100--,DD,Desconocida,Minijefe,Estáte bien atento porque solo lo explicaré una vez (los que programaron esto no saben hacer buenos tutoriales),dialogue01,normal,neutral,clientZERO,,,,,
#DD06010200--,DD,Desconocida,Minijefe,En mi ausencia tendrás que atender a la más selecta de las clientelas ( y a algún elemental que otro).,dialogue02,normal,neutral,clientZERO,,,,,
#DD06010300--,DD,Desconocida,Minijefe,"Cuenta bien el valor de los productos, con la información del desplegable de la derecha y si necesitas consultar las normativas, estarán a tu izquierda. ¡No quiero perder ni una sola moneda cuando vuelva!",dialogue03,exclamative,neutral,clientZERO,,,,,
#DD06010400--,DD,Desconocida,Minijefe,Las normativas afectan a razas y a productos en concreto. La raza del cliente se indicará abajo a la izquierda en el traductor de texto donde te aparecerán los diálogos.,dialogue04,normal,neutral,clientZERO,,,,,
#DD06010500--,DD,Desconocida,Minijefe,Algunos te traerán cupones ¡ESOS SON LOS PEORES! Cada raza de cupón hace que una serie de objetos salgan gratis. Es muy goloso querer llevarse un objeto gratis con un cupón falso.,dialogue05,exclamative,neutral,clientZERO,,,,,
#DD06010600--,DD,Desconocida,Minijefe,"Por cierto, los cupones (al contrario que en tu aburrido mundo humano) son criaturas un poco menos adorables que yo. Revisa el diseño en tu maletín para ver si te han traído uno verdadero.",dialogue06,normal,neutral,clientZERO,,,,,
#DD06010700--,DD,Desconocida,Minijefe,"También puede que aparezca un detective preguntando cosas. No nos interesa tenerle en contra (dicen que tiene un humor de perros), así que responde correctamente a lo que te pregunte.",dialogue07,normal,neutral,clientZERO,,,,,
#DD06019900--,DD,Desconocida,Minijefe,"Bueno cacho carne, me voy que me empieza el concierto de Ratsune Piku en la MadridOtaku. Suerte en tu primer día, no hagas que sea el último.",end,normal,neutral,clientZERO,,,,,
#DD03010001--,DD,Limbásticos,Antonio,Hola frikicillo ¿Te puedo llamar frikicillo? ,init,interrogative,neutral,clientONE,,,,,
#DD03010101--,DD,Limbásticos,Antonio,(...) Veo que no eres de muchas palabras ¿No... tendrás complejo de prota de un RPG no? Jia jia jia jia,dialogue01,interrogative,neutral,clientONE,,,,,
#DD03010201--,DD,Limbásticos,Antonio,Ya que sacas el tema de los Videojuegos... no es por presumir pero...estoy haciendo el próximo GOTY.,dialogue02,normal,neutral,clientONE,,,,,
#DD03010301--,DD,Limbásticos,Antonio,"""S.A.L. Snail Across Lands"", un juego en el que encarnas a un caracol que perdió su concha.",dialogue03,normal,neutral,clientONE,,,,,
#DD03010401--,DD,Limbásticos,Antonio,"Es una historia de superación, pixelart, y ningún diálogo que explique absolutamente nada del argumento.",dialogue04,normal,neutral,clientONE,,,,,
#DD03010501--,DD,Limbásticos,Antonio,El prota se va a llamar Anacleto ¿Lo pillas? aNaCleto. ¡Cloruro Sódico tío! Que salao soy jia jia jia,dialogue05,exclamative,neutral,clientONE,,,,,
#DD03019901--,DD,Limbásticos,Antonio,"Bueno, que me acabas liando, cóbrame estas vainas locas que tengo que volver a la mancueva.",end,normal,neutral,clientONE,,,,,
#DD0301AA01--,DD,Limbásticos,Antonio,"Esta yetinergía me pone a tope, con esto fijo que tengo la demo para el sábado.",tick,normal,neutral,clientONE,,,,,
#DD0301BB01--,DD,Limbásticos,Antonio,¡Si estaba justo! Así no se apoya a los proyectos indie...,cross,exclamative,neutral,clientONE,,,,,
#DD02010002--,DD,Híbridos,Elvog,(ERUCTA BASTÍSIMO) ¡BROOOOOOOOO!,init,exclamative,neutral,clientTWO,,,,,
#DD02010102--,DD,Híbridos,Elvog,Menuda feshta tienen ahí a'lao (hip),dialogue01,normal,neutral,clientTWO,,,,,
#DD02010202--,DD,Híbridos,Elvog,Lleevo dos díassh seguidos haciendo...net...¿netwerking? Esho de hacer contactos....,dialogue02,interrogative,neutral,clientTWO,,,,,
#DD02010302--,DD,Híbridos,Elvog,"Net... net...NETBARKING de eshe (eructo), que esh que neceshito conocer gente (hip)",dialogue03,normal,neutral,clientTWO,,,,,
#DD02010402--,DD,Híbridos,Elvog,Hace nada me... me echaron de.... de... (Elvog te mira muy fuerte),dialogue04,normal,neutral,clientTWO,,,,,
#DD02010502--,DD,Híbridos,Elvog,¿Eresh... Eresh humano? (eructo de escala 3.2) WOW (eructito)...hay gente peorrrr que yo...,dialogue05,interrogative,neutral,clientTWO,,,,,
#DD02010602--,DD,Híbridos,Elvog,"Pero no estesh trishte... Podría sher peor, podrías sher un... Elemental gorjgorjgorjgorj (se eructo-ríe)",dialogue06,normal,neutral,clientTWO,,,,,
#DD02019902--,DD,Híbridos,Elvog,"Bueno, cóbrate eshtas cervecitas freshcas que he pillado dos porque hoy había deshcuento para los Híbridosh",end,normal,neutral,clientTWO,,,,,
#DD0201AA02--,DD,Híbridos,Elvog,"Bro, eresh un tío legal, podrás ser humano pero... pero... no me acuerdo como seguía (eructo de despedida)",tick,normal,neutral,clientTWO,,,,,
#DD0201BB02--,DD,Híbridos,Elvog,Pero... ¿hoy no era jueveshh? (Eructa de manera incrédula a la par que confusa),cross,interrogative,neutral,clientTWO,,,,,
#DD04010003--,DD,Magos Oscuros,Elidora,"Eh, tú, ser inferior, tienes pinta de manejarte bien con un mazo de madera.",init,normal,neutral,clientTHREE,,,,,
#DD04010103--,DD,Magos Oscuros,Elidora,Entréname un rato a mis súbditos que últimamente se me mueren al primer roce a sus cabezas,dialogue01,normal,neutral,clientTHREE,,,,,
#DD04010203--,DD,Magos Oscuros,Elidora,Apareceré de vez en cuando para echar un ojo a tus progresos,dialogue02,normal,neutral,clientTHREE,,,,,
#DD0401MG03--,DD,Magos Oscuros,Elidora,¡Ni se te ocurra atizarme que te maldigo la existencia!,minigame,exclamative,neutral,clientTHREE,,,,,
#DD04060004--,DD,Magos Oscuros,Pijus Magnus,(Procede a mirarte con un desprecio casi tan grande como su cabeza),init,normal,neutral,clientFOUR,,,,,
#DD04060104--,DD,Magos Oscuros,Pijus Magnus,¿Humanos aquí? ¿EN EL REINO DE MI PAPI?,dialogue01,interrogative,neutral,clientFOUR,,,,,
#DD04060204--,DD,Magos Oscuros,Pijus Magnus,Ese Minijefe nunca fue de fiar... seguro que te tiene aquí porque le dan ayudas,dialogue02,normal,neutral,clientFOUR,,,,,
#DD04060304--,DD,Magos Oscuros,Pijus Magnus,¿Hueles eso? ES TU EXISTENCIA Y ME MOLESTA. Así que espero una compensación.,dialogue03,interrogative,neutral,clientFOUR,,,,,
#DD04069904--,DD,Magos Oscuros,Pijus Magnus,Si no tienes en cuenta la normativa yo no le diré a papi lo mal que lo pasé viendo tus desporporcionados brazos humanos.,end,normal,neutral,clientFOUR,,,,,
#DD0406AA04--,DD,Magos Oscuros,Pijus Magnus,"Sabia elección, diría que pareces un humano listo, pero no creo en criaturas fantásticas.",tick,normal,neutral,clientFOUR,,,,,
#DD0406BB04--,DD,Magos Oscuros,Pijus Magnus,¡A MI PAPI VAS!,cross,exclamative,neutral,clientFOUR,,,,,
#DD05040005--,DD,Tecnópedos,Rave-N,YO-YO-YO ¡¡CÓMO ESTÁN LAS MÁQUINAS!!,init,exclamative,neutral,clientFIVE,,,,,
#DD05040105--,DD,Tecnópedos,Rave-N,"Uy... Perdona, la costumbre, espero no haberte ofendido",dialogue01,normal,neutral,clientFIVE,,,,,
#DD05040205--,DD,Tecnópedos,Rave-N,Se podría decir que ya voy con el piloto automático jirijirijirijiri,dialogue02,normal,neutral,clientFIVE,,,,,
#DD05040305--,DD,Tecnópedos,Rave-N,"No me puedo quejar de trabajo, pero ultimamente solo encadeno fiesta tras fiesta...",dialogue03,normal,neutral,clientFIVE,,,,,
#DD05040405--,DD,Tecnópedos,Rave-N,Aunque hoy me acaban de encargar algo que me hace mucha ilusión: una música de oficina.,dialogue04,normal,neutral,clientFIVE,,,,,
#DD05040505--,DD,Tecnópedos,Rave-N,Sisi como lo oyes ¿Sabes la típica música de espera rollo ascensor? Pues eso.,dialogue05,interrogative,neutral,clientFIVE,,,,,
#DD05040605--,DD,Tecnópedos,Rave-N,De hecho iba pegarme un caprichito porque ya me pasaron un adelanto y justo encontré este cupón,dialogue06,normal,neutral,clientFIVE,,,,,
#DD05049905--,DD,Tecnópedos,Rave-N,"Espero que sea verdadero, porque con lo que ahorre me da para pillarme un mejor teclado.",end,normal,neutral,clientFIVE,,,,,
#DD0504AA05--,DD,Tecnópedos,Rave-N,¿Era bueno? Este día solo mejora :D,tick,interrogative,neutral,clientFIVE,,,,,
#DD0504BB05--,DD,Tecnópedos,Rave-N,¿Era falso? Vaya... Ya decía yo que no podía estar saliendo todo tan bien :C,cross,interrogative,neutral,clientFIVE,,,,,
#DD01040006--,DD,Elementales,Rocón,Ho-ho.... Hoooo.... Hola....,init,normal,neutral,clientSIX,,,,,
#DD01040106--,DD,Elementales,Rocón,Perd... Perdo.... Perdona mi tart...tartamu...dez,dialogue01,normal,neutral,clientSIX,,,,,
#DD01040206--,DD,Elementales,Rocón,No suel... suelo sa...salir de casa muuuu...muchooo...,dialogue02,normal,neutral,clientSIX,,,,,
#DD01040306--,DD,Elementales,Rocón,Porr...Porrque... la gen...te no....,dialogue03,normal,neutral,clientSIX,,,,,
#DD01040406--,DD,Elementales,Rocón,La geeeeeeen... gennnnte... no me tiene paaa...,dialogue04,normal,neutral,clientSIX,,,,,
#DD01040506--,DD,Elementales,Rocón,No me tiene paaaaa... pacien.....,dialogue05,normal,neutral,clientSIX,,,,,
#DD01040606--,DD,Elementales,Rocón,Paciencccccccc....,dialogue06,normal,neutral,clientSIX,,,,,
#DD01040706--,DD,Elementales,Rocón,Paciennnncia,dialogue07,normal,neutral,clientSIX,,,,,
#DD01040806--,DD,Elementales,Rocón,Y se cabr...ean conmi....go. Pero hoooooooy es un dddd...,dialogue08,normal,neutral,clientSIX,,,,,
#DD01040906--,DD,Elementales,Rocón,Dddd....ía especial....porque cumpl.... cumple años mi pppppapi,dialogue09,normal,neutral,clientSIX,,,,,
#DD01041006--,DD,Elementales,Rocón,Y querrrr...ía regalarrrrle algo essssss... especcccccial,dialogue10,normal,neutral,clientSIX,,,,,
#DD01041106--,DD,Elementales,Rocón,Aparrrrte un seeeee. señorrrr me ha vendi...veeeendido este cupppp...,dialogue11,normal,neutral,clientSIX,,,,,
#DD01041206--,DD,Elementales,Rocón,"Este cuppp...ón muy baaa... barato, así que me vaaaaa a sssss...",dialogue12,normal,neutral,clientSIX,,,,,
#DD01049906--,DD,Elementales,Rocón,A ssssalir más barato el regalo ¿Q....Qué bien nnn....no?,end,interrogative,neutral,clientSIX,,,,,
#DD0104AA06--,DD,Elementales,Rocón,"Grrr...acias, seguuuuuro que ppppapi se al... se al.... se aleeeegra.",tick,normal,neutral,clientSIX,,,,,
#DD0104BB06--,DD,Elementales,Rocón,¿Ese señ... señññññor me mmmmm... mintió?,cross,interrogative,neutral,clientSIX,,,,,
#DD06020007--,DD,Desconocida,Detective,Hola dependiente. Nos han informado de alguien con un ego enorme anda intentando engañar a gente.,init,normal,neutral,clientSEVEN,,,,,
#DD06020107--,DD,Desconocida,Detective,Se aprovecha de su status para intimidar y conseguir lo que quiere ¿Podrías indicarme si alguno de estos clientes coincide con esta descripción?,dialogue01,interrogative,neutral,clientSEVEN,,Rocón,Pijus Magnus,Elvog,Pijus Magnus
#DD06029907--,DD,Desconocida,Detective,"Muchas gracias por su colaboración, su información me es muy útil, seguramente me vea más días por aquí.",end,normal,neutral,clientSEVEN,,,,,
#DD06030099--,DD,Desconocida,Mikujefe,"(cantando) Riku, Riku, oo ee oo, Riku Rik....(tose en otaku)",init,normal,neutral,clientFINAL,,,,,
#DD06030199--,DD,Desconocida,Mikujefe,Bueno ¿Qué tal tu primer día? Espero que bien porque eso significa jugosos beneficios para mi,dialogue01,interrogative,neutral,clientFINAL,,,,,
#DD06030299--,DD,Desconocida,Mikujefe,Porque algún inepto juez no ha considerado digno mi cosplay  y no me he llevado el premio económico que claramente tenía asegurado.,dialogue02,normal,neutral,clientFINAL,,,,,
#DD06030399--,DD,Desconocida,Mikujefe,Y además estés llevas jugando demasiado tiempo gratis a esta demo y eso no es bueno para mi negocio,dialogue03,normal,neutral,clientFINAL,,,,,
#DD06030499--,DD,Desconocida,Mikujefe,"¿Pero sabes lo que sí que es bueno para el negocio? Los NF... Que no hombre, ni que fuera RillyWex",dialogue04,interrogative,neutral,clientFINAL,,,,,
#DD06030599--,DD,Desconocida,Mikujefe,"Pero nunca está de más un feedback constructivo, así que te dejo en manos de Jack 'O' Boo que te hará unas preguntitas al respecto.",dialogue05,normal,neutral,clientFINAL,,,,,
#DD06039999--,DD,Desconocida,Mikujefe,"Nos veremos más adelante en Steam, ¡Y EN LAS REDES! ¡USA EL QR!",end,exclamative,neutral,clientFINAL,,,,,
#0106010000--,01,Desconocida,Minijefe,"Hola chico nuevo, soy tu jefe.",init,normal,neutral,clientZERO,,,,,
#0106010100--,01,Desconocida,Minijefe,"Y cómo sé que es tu primer día, te estaré observando.",dialogue01,normal,neutral,clientZERO,,,,,
#0106010200--,01,Desconocida,Minijefe,Porque sé que no serás capaz de atender a los clientes bien.,dialogue02,normal,neutral,clientZERO,,,,,
#0106010300--,01,Desconocida,Minijefe,Ya sabes que todos los humanos sois inútiles.,dialogue03,normal,neutral,clientZERO,,,,,
#0106010400--,01,Desconocida,Minijefe,"No lo digo yo, lo dice vuestro cerebro enano.",dialogue04,normal,neutral,clientZERO,,,,,
#0106010500--,01,Desconocida,Minijefe,"Pero bueno, como iba diciendo… ¡ATIENDE BIEN!",dialogue05,exclamative,neutral,clientZERO,,,,,
#0106010600--,01,Desconocida,Minijefe,Para cobrar usa la CAJA REGISTRADORA.,dialogue06,normal,neutral,clientZERO,,,,,
#0106010700--,01,Desconocida,Minijefe,"Y como cobres mal, te quitaré dinero de tu querido tarro.",dialogue07,normal,neutral,clientZERO,,,,,
#0106010800--,01,Desconocida,Minijefe,Tienes el catálogo de la tienda a la derecha para saber si el cliente tiene dinero suficiente.,dialogue08,normal,neutral,clientZERO,,,,,
#0106010900--,01,Desconocida,Minijefe,"Además tendrás una ayuda, la cabeza del antiguo empleado.",dialogue09,normal,neutral,clientZERO,,,,,
#0106011000--,01,Desconocida,Minijefe,Se la arrancó un cliente al que no le vendió su alcohol.,dialogue10,normal,neutral,clientZERO,,,,,
#0106011100--,01,Desconocida,Minijefe,Menos mal que su sistema de traducción sigue funcionando.,dialogue11,normal,neutral,clientZERO,,,,,
#0106011200--,01,Desconocida,Minijefe,No iba a comprarte otro traductor como ese no fuera.,dialogue12,normal,neutral,clientZERO,,,,,
#0106019900--,01,Desconocida,Minijefe,"Suerte en tu primer día, chico nuevo.",end,normal,neutral,clientZERO,,,,,
#0104020001--,01,Magos Oscuros,Geeraard,"Buenas ciudadano, ya llegó el inigualable Geeraard, gracias, gracias…",init,normal,neutral,clientONE,,,,,
#0104020101--,01,Magos Oscuros,Geeraard,"Buenas ciudadano, ya llegó el inigualable Geeraard, gracias, gracias…",dialogue01,normal,neutral,clientONE,,,,,
#0104020201--,01,Magos Oscuros,Geeraard,"Buenas ciudadano, ya llegó el inigualable Geeraard, gracias, gracias…",dialogue02,normal,neutral,clientONE,,,,,
#0104020301--,01,Magos Oscuros,Geeraard,¿Por qué no has empezado a llorar de la alegría y a pedirme un autógrafo mientras estás de rodillas?,dialogue03,interrogative,neutral,clientONE,,,,,
#0104020401--,01,Magos Oscuros,Geeraard,"¡Cómo no me conoces! Todos aquí me conocen, el héroe de héroes, quien derrotó al Rey Demonio con una sola daga y los ojos vendados.",dialogue04,exclamative,neutral,clientONE,,,,,
#0104020501--,01,Magos Oscuros,Geeraard,"Vamos… Todos mis admiradores, es decir, todo el reino, saben que soy el mejor héroe que ha existido en la historia.",dialogue05,normal,neutral,clientONE,,,,,
#0104029901--,01,Magos Oscuros,Geeraard,"Cóbrame esto, así al menos esta charla dejará de ser tan incómoda.",end,normal,neutral,clientONE,,,,,
#010402AA01--,01,Magos Oscuros,Geeraard,"Humano, deberías leer alguna de mis grandes historias, te firmaré el pecho la próxima vez.",tick,normal,neutral,clientONE,,,,,
#010402BB01--,01,Magos Oscuros,Geeraard,¡QUÉ INSOLENCIA! Aprende a contar monedas al menos,cross,exclamative,neutral,clientONE,,,,,
#0102010002--,01,Híbridos,Elvog,Buennnasss hip... no eresss el de sieeempre...,init,normal,neutral,clientTWO,,,,,
#0102010102--,01,Híbridos,Elvog,"Me despidieronn hip por beber, dizque viejo hip.",dialogue01,normal,neutral,clientTWO,,,,,
#0102010202--,01,Híbridos,Elvog,"Dice que no trabajo nada, por estar mayor.",dialogue02,normal,neutral,clientTWO,,,,,
#0102010302--,01,Híbridos,Elvog,"Si tengo 22 añitos, toy en la flor de la juventud.",dialogue03,normal,neutral,clientTWO,,,,,
#0102019902--,01,Híbridos,Elvog,"Pero bueno cobrame, anda hip.",end,normal,neutral,clientTWO,,,,,
#010201AA02--,01,Híbridos,Elvog,"Gracias mushacho hip, eres mi nuevo preferido hip.",tick,normal,neutral,clientTWO,,,,,
#010201BB02--,01,Híbridos,Elvog,"Bah, el otro era mejor hip.",cross,normal,neutral,clientTWO,,,,,
#0103010003--,01,Limbásticos,Antonio,Ey... Hola... soy Antonio.,init,normal,neutral,clientTHREE,,,,,
#0103010103--,01,Limbásticos,Antonio,Estoy tan cansado que ya ni vivo... ja ja ja... es literal.,dialogue01,normal,neutral,clientTHREE,,,,,
#0103019903--,01,Limbásticos,Antonio,Perdón por los chistes malos. Cobrame.,end,normal,neutral,clientTHREE,,,,,
#010301AA03--,01,Limbásticos,Antonio,Gracias... creo que di todo el dinero.,tick,normal,neutral,clientTHREE,,,,,
#010301BB03--,01,Limbásticos,Antonio,"Uy, me faltaban dos monedas, mi mal.",cross,normal,neutral,clientTHREE,,,,,
#0101050004--,01,Elementales,Tapicio,Saludos desde mi existencia sombría.,init,normal,neutral,clientFOUR,,,,,
#0101050104--,01,Elementales,Tapicio,Ser tapiz es vivir una esclavitud decorativa.,dialogue01,normal,neutral,clientFOUR,,,,,
#0101050204--,01,Elementales,Tapicio,"Mi vida es como una canción emo: larga, triste y mal tejida.",dialogue02,normal,neutral,clientFOUR,,,,,
#0101059904--,01,Elementales,Tapicio,Cóbrame antes de que este día me deprima más.,end,normal,neutral,clientFOUR,,,,,
#010105AA04--,01,Elementales,Tapicio,"Gracias, una tristeza menos hoy.",tick,normal,neutral,clientFOUR,,,,,
#010105BB04--,01,Elementales,Tapicio,Otra sombra más en mi telar.,cross,normal,neutral,clientFOUR,,,,,
#0105010005--,01,Tecnópedos,Denjirenji,Antes era samurái... ahora solo caliento comida...,init,normal,neutral,clientFIVE,,,,,
#0105010105--,01,Tecnópedos,Denjirenji,¡Perdone joven! Buenos días.,dialogue01,exclamative,neutral,clientFIVE,,,,,
#0105019905--,01,Tecnópedos,Denjirenji,Tengo algo de prisa si no le molesta joven humano.,end,normal,neutral,clientFIVE,,,,,
#010501AA05--,01,Tecnópedos,Denjirenji,Creo que era justo... ¡gracias!,tick,exclamative,neutral,clientFIVE,,,,,
#010501BB05--,01,Tecnópedos,Denjirenji,"Ay no, por una moneda... espero que no me despidan.",cross,normal,neutral,clientFIVE,,,,,
#0102030006--,01,Híbridos,Mara,"Buenas querido, de verdad que este sitio necesita un ascensor.",init,normal,neutral,clientSIX,,,,,
#0102030106--,01,Híbridos,Mara,Estoy cada día cansada desde que no está mi marido.,dialogue01,normal,neutral,clientSIX,,,,,
#0102030206--,01,Híbridos,Mara,Me lo comí y ahora criar a mi pequeño es más difícil.,dialogue02,normal,neutral,clientSIX,,,,,
#0102039906--,01,Híbridos,Mara,"Eso me recuerda que debo ir al zoo a por él, ¿me puedes cobrar?",end,interrogative,neutral,clientSIX,,,,,
#010203AA06--,01,Híbridos,Mara,"Gracias, espero que tu pareja te coma pronto también.",tick,normal,neutral,clientSIX,,,,,
#010203BB06--,01,Híbridos,Mara,Por tu culpa mi hijo no tendrá su mascota.,cross,normal,neutral,clientSIX,,,,,
#0103030007--,01,Limbásticos,Giovanni,"¡Ahoy! Soy Giovanni, encontré el Necronomicón.",init,exclamative,neutral,clientSEVEN,,,,,
#0103030107--,01,Limbásticos,Giovanni,"Voy a cocinar algo divino, literalmente.",dialogue01,normal,neutral,clientSEVEN,,,,,
#0103039907--,01,Limbásticos,Giovanni,Estos son los ingredientes para mi plato.,end,normal,neutral,clientSEVEN,,,,,
#010303AA07--,01,Limbásticos,Giovanni,"Gracias, probarás el plato luego",tick,normal,neutral,clientSEVEN,,,,,
#010303BB07--,01,Limbásticos,Giovanni,¡Mamma mía! Sin esto no hay receta.,cross,exclamative,neutral,clientSEVEN,,,,,
#0101040008--,01,Elementales,Rocón,Ho-hola... per-perdona la tar-tartamudez.,init,normal,neutral,clientEIGHT,,,,,
#0101040108--,01,Elementales,Rocón,Quiero hacerle un regalo a mi pa-papá.,dialogue01,normal,neutral,clientEIGHT,,,,,
#0101049908--,01,Elementales,Rocón,Es un gato muerto... pero con amor. Cóbrame.,end,normal,neutral,clientEIGHT,,,,,
#010104AA08--,01,Elementales,Rocón,"Gra-gra-gracias, le encantará.",tick,normal,neutral,clientEIGHT,,,,,
#010104BB08--,01,Elementales,Rocón,Jo-jopetas... y yo que quería sorprenderlo.,cross,normal,neutral,clientEIGHT,,,,,
#0106010099--,01,Desconocida,Minijefe,Seguro fue agotador... Pero me da igual.,init,normal,neutral,clientFINAL,,,,,
#0106010199--,01,Desconocida,Minijefe,Y un pajarito llamado Inspector de Empleo me ha dicho que no tienes casa.,dialogue01,normal,neutral,clientFINAL,,,,,
#0106010299--,01,Desconocida,Minijefe,"Menos mal que tienes un jefe tan generoso y rico, así que te prestaré una de las mejores viviendas del reino.",dialogue02,normal,neutral,clientFINAL,,,,,
#0106010399--,01,Desconocida,Minijefe,Ese maravilloso lugar se llama: El sótano de la casa de mi madre.,dialogue03,normal,neutral,clientFINAL,,,,,
#0106019999--,01,Desconocida,Minijefe,Espero que te guste.,end,normal,neutral,clientFINAL,,,,,
#0206010000--,02,Desconocida,Minijefe,"Buenos días chico nuevo, soy el jefe.",init,normal,neutral,clientZERO,,,,,
#0206010100--,02,Desconocida,Minijefe,"¿Qué tal tu primer día? Nah, me da igual.",dialogue01,interrogative,neutral,clientZERO,,,,,
#0206010200--,02,Desconocida,Minijefe,"Hoy es “Magic Friday”, aunque lo seguirá siendo el resto del año, como todos los años...",dialogue02,normal,neutral,clientZERO,,,,,
#0206010300--,02,Desconocida,Minijefe,"Los magos tienen rebajas, y el resto de razas trabajan más a cambio.",dialogue03,normal,neutral,clientZERO,,,,,
#0206010400--,02,Desconocida,Minijefe,También han prohibido varias bebidas a algunas razas.,dialogue04,normal,neutral,clientZERO,,,,,
#0206010500--,02,Desconocida,Minijefe,"Revisa las normas, están a la izquierda de tu pantalla.",dialogue05,normal,neutral,clientZERO,,,,,
#0206019900--,02,Desconocida,Minijefe,"Buena suerte, chico nuevo.",end,normal,neutral,clientZERO,,,,,
#0202020001--,02,Híbridos,Lepión,Hola humano.,init,normal,neutral,clientONE,,,,,
#0202020101--,02,Híbridos,Lepión,Ayer vino ese microondas… y te dio mal el cambio.,dialogue01,normal,neutral,clientONE,,,,,
#0202020201--,02,Híbridos,Lepión,Traje una moneda de más para justificar su despido.,dialogue02,normal,neutral,clientONE,,,,,
#0202029901--,02,Híbridos,Lepión,"En fin, cóbrame esto.",end,normal,neutral,clientONE,,,,,
#020202AA01--,02,Híbridos,Lepión,"Adiós, humano tonto. ",tick,normal,neutral,clientONE,,,,,
#020202BB01--,02,Híbridos,Lepión,Ni contar sabes. Has perdido a los clientes del barrio chino.,cross,normal,neutral,clientONE,,,,,
#0203030002--,02,Limbásticos,Giovanni,"Bon día, el plato de ayer salió… ¡perfecto!",init,exclamative,neutral,clientTWO,,,,,
#0203030102--,02,Limbásticos,Giovanni,Aunque hablaba lenguas antiguas… raro.,dialogue01,normal,neutral,clientTWO,,,,,
#0203030202--,02,Limbásticos,Giovanni,Este nuevo plato va a necesitar algo más picante.,dialogue02,normal,neutral,clientTWO,,,,,
#0203030302--,02,Limbásticos,Giovanni,Dice el necronomicón que necesita lava del mismísimo infierno.,dialogue03,normal,neutral,clientTWO,,,,,
#0203039902--,02,Limbásticos,Giovanni,Pero creo que con una bebida energética será más que suficiente.,end,normal,neutral,clientTWO,,,,,
#020303AA02--,02,Limbásticos,Giovanni,"Gracias, te dejaré probarlo",tick,normal,neutral,clientTWO,,,,,
#020303BB02--,02,Limbásticos,Giovanni,¿Tengo prohibidos estos ingredientes? Qué mundo sin sabor.,cross,interrogative,neutral,clientTWO,,,,,
#0204050003--,02,Magos Oscuros,Manomo,¡Hola pequeñín! Soy Manolo Cabeza de Pico.,init,exclamative,neutral,clientTHREE,,,,,
#0204050103--,02,Magos Oscuros,Manomo,Uno de mis gnomos se coló en la tienda.,dialogue01,normal,neutral,clientTHREE,,,,,
#0204050203--,02,Magos Oscuros,Manomo,Se llama José Miguel Culo Escurridizo.,dialogue02,normal,neutral,clientTHREE,,,,,
#0204050303--,02,Magos Oscuros,Manomo,"Si lo encuentras varias veces, será tuyo.",dialogue03,normal,neutral,clientTHREE,,,,,
#020405--03--,02,Magos Oscuros,Manomo,"No sé si te gustará tenerle, ya que es un pesado, suerte.",break,normal,neutral,clientTHREE,,,,,
#0203020004--,02,Limbásticos,Cululu,¿Buenos días? No lo sé… solo veo morado.,init,interrogative,neutral,clientFOUR,,,,,
#0203020104--,02,Limbásticos,Cululu,"Te habré confundido un poco, soy el del orbe el que habla.",dialogue01,normal,neutral,clientFOUR,,,,,
#0203020204--,02,Limbásticos,Cululu,"Me llamo Cululú, y hasta hace poco era un híbrido.",dialogue02,normal,neutral,clientFOUR,,,,,
#0203020304--,02,Limbásticos,Cululu,"Me morí ayer en una gasolinera, y acabé dentro de este orbe.",dialogue03,normal,neutral,clientFOUR,,,,,
#0203020404--,02,Limbásticos,Cululu,"Vi a un tío con un libro rarísimo que parecía hacer un ritual, y al verme, me dió un golpe con este orbe.",dialogue04,normal,neutral,clientFOUR,,,,,
#0203020504--,02,Limbásticos,Cululu,"Y al despertar, pues me quedé encerrado aquí, aunque supongo que esto no sea un problema para mi cita.",dialogue05,normal,neutral,clientFOUR,,,,,
#0203020604--,02,Limbásticos,Cululu,"Pero la vida es una, y esa manguro es mi tipo ideal.",dialogue06,normal,neutral,clientFOUR,,,,,
#0203020704--,02,Limbásticos,Cululu,Necesito verme bien... dentro de lo que cabe.,dialogue07,normal,neutral,clientFOUR,,,,,
